{
  "schema_version": "asw.observation_authorization.v1",
  "authorization_id": "auth_vs",
  "authorized_by": "user:local",
  "enabled": true,
  "scopes": [
    {
      "application_id": "app.visual-studio",
      "source_id": "fs:vs-workspace",
      "source_kind": "filesystem",
      "filesystem_roots": [
        "C:\\src\\project"
      ],
      "executable_names": [],
      "job_kinds": [],
      "uia_process_names": [],
      "adapter_contract": null
    },
    {
      "application_id": "app.visual-studio",
      "source_id": "uia:vs",
      "source_kind": "uia",
      "filesystem_roots": [],
      "executable_names": [],
      "job_kinds": [],
      "uia_process_names": [
        "devenv.exe"
      ],
      "adapter_contract": null
    }
  ],
  "created_at": "2026-08-01T12:09:00-04:00",
  "updated_at": "2026-08-01T12:09:00-04:00"
}
